review_id,customer_name,review_text
1,  Samuel Osei ,"   Shipping took forever and when it arrived, the wrong item was in the box.  "
2,Zara Ahmed,Way too expensive for what you actually get. Feels like a waste of money.
3,Ava Thompson,Support team was incredibly helpful and friendly. Five stars all around.
4,Layla Hassan,The app constantly freezes and support never got back to me. Frustrating.
5,Mia Andersson,   Decent quality for the price point. Meets basic expectations.  
6,Emma Johnson,Super fast shipping and the product works exactly as described. Impressed!
7,Noah Kim,"Delivery took about a week, which seems standard I guess."
8,  Chloe Dubois ,Worst customer service I've dealt with. They never resolved my complaint.
9,Mateo Garcia,   The packaging was excellent and the item arrived in perfect condition. Very happy!  
10,Benjamin Lee,I received the item as described. No complaints but nothing stood out either.
11,Ethan Wright,"The checkout process was straightforward, nothing memorable either way."
12,Oliver Bennett,"Poor build quality, it stopped working within a week. Would not recommend."
13,Felix Bauer,   Terrible experience. My order arrived three weeks late and no one responded to my emails.  
14,Leo Fischer,Packaging was damaged and the item inside was broken. Requesting a refund.
15,  Isabella Rodriguez ,The product broke after two days of use. Very disappointed with the quality.
16,Henry Clarke,Overpriced and underwhelming. Not worth the money at all.
17,James Chen,   Average experience overall. The product works as expected.  
18,Ryan Murphy,"It's fine for the price. Not amazing, not terrible."
19,Grace Nguyen,"The product is okay, does what it says but nothing special."
20,Aisha Patel,Charged me twice for the same order and it took a week to get it fixed.
21,Daniel Novak,   The instructions were unclear and support was no help when I asked questions.  
22,  Amara Okafor ,"Customer service responded within a day, which was reasonable."
23,Sofia Rossi,"Everything about this purchase felt premium, from the packaging to the product itself."
24,Priya Sharma,"Great customer service, they resolved my issue within minutes. Highly recommend!"
25,Lucas Silva,   I was skeptical at first but this exceeded all my expectations. Love it.  
26,Olivia Martin,The website is confusing and the checkout process kept crashing on me.
27,Jack Sullivan,Took a bit longer than expected but eventually arrived in good shape.
28,Maria Gonzalez,Customer support answered all my questions quickly and professionally.
29,  Liam O'Brien ,   Fantastic experience from start to finish. Will definitely be ordering again.  
30,Hannah Wilson,Ordered on Monday and it arrived by Wednesday. Couldn't be happier with the speed!
31,Samuel Osei,This is exactly what I needed. Easy to set up and works perfectly every time.
32,Zara Ahmed,Best purchase I've made this year. The build quality is outstanding.
33,Ava Thompson,"   The packaging was standard, nothing fancy but did the job.  "
34,Layla Hassan,The team went above and beyond to make sure I was satisfied. Truly great service.
35,Mia Andersson,Smooth checkout process and the app is really easy to use. Great job!
36,  Emma Johnson ,"Nothing wrong with it, just didn't blow me away either."
37,Noah Kim,   I've been waiting two weeks for a response about my missing order. Awful.  
38,Chloe Dubois,Received a damaged item and it took forever to get a replacement sorted out.
39,Mateo Garcia,The quality is amazing for the price. Would recommend to anyone.
40,Benjamin Lee,Absolutely love this product! Delivery was fast and the quality exceeded my expectations.
41,Ethan Wright,   Customer service was rude and unhelpful when I tried to get a refund.  
42,Oliver Bennett,"It works fine, though I probably wouldn't buy it again."
43,Tom Bradley,
44,Nina Petrov,   
3,Ava Thompson,Support team was incredibly helpful and friendly. Five stars all around.
11,Ethan Wright,"The checkout process was straightforward, nothing memorable either way."
21,Daniel Novak,   The instructions were unclear and support was no help when I asked questions.  
31,Samuel Osei,This is exactly what I needed. Easy to set up and works perfectly every time.
